{
  "$schema": "https://json-schema.org/draft/2020-12/schema",
  "$id": "https://schemas.ardyn.ai/boundary-maps/ardyn.phase-5.31.human-tool-inspection-disposition-boundary.schema.json",
  "title": "ARDYN Boundary Map: ardyn.phase-5.31.human-tool-inspection-disposition-boundary",
  "description": "Auto-generated JSON Schema for boundary-map artifact validation. Enforces shape + safety invariants.",
  "type": "object",
  "required": [
    "schema",
    "schemaVersion",
    "phase",
    "artifactKind",
    "metadataGeneratedAt",
    "sourcePhase",
    "dispositionBoundarySummary",
    "dispositionBoundaryInputShape",
    "dispositionBoundaryResultShape",
    "dispositionBoundaryCases",
    "dispositionBoundary",
    "blockedRuntimeEffect",
    "serveRuntimeBlockedBehavior",
    "forbiddenBehavior",
    "filesAllowedToChange",
    "filesForbiddenToChange",
    "validationCommands"
  ],
  "properties": {
    "schema": {
      "type": "string",
      "const": "ardyn.phase-5.31.human-tool-inspection-disposition-boundary"
    },
    "schemaVersion": {
      "type": "string"
    },
    "phase": {
      "type": "string"
    },
    "artifactKind": {
      "type": "string"
    },
    "metadataGeneratedAt": {
      "type": "string"
    },
    "sourcePhase": {
      "type": "object"
    },
    "dispositionBoundarySummary": {
      "type": "object"
    },
    "dispositionBoundaryInputShape": {
      "type": "object"
    },
    "dispositionBoundaryResultShape": {
      "type": "object"
    },
    "dispositionBoundaryCases": {
      "type": "array"
    },
    "dispositionBoundary": {
      "type": "object"
    },
    "blockedRuntimeEffect": {
      "type": "object"
    },
    "serveRuntimeBlockedBehavior": {
      "type": "object"
    },
    "forbiddenBehavior": {
      "type": "object"
    },
    "filesAllowedToChange": {
      "type": "array"
    },
    "filesForbiddenToChange": {
      "type": "array"
    },
    "validationCommands": {
      "type": "array"
    }
  },
  "additionalProperties": true
}
