{
  "schema": "ardyn.phase-5.31.human-tool-inspection-disposition-boundary",
  "schemaVersion": "0.1.0",
  "phase": "phase-5.31-human-tool-inspection-disposition-boundary",
  "artifactKind": "human-tool-inspection-disposition-boundary",
  "metadataGeneratedAt": "1970-01-01T00:00:00.000Z",
  "sourcePhase": {
    "phase": "phase-5.30-non-authorizing-evaluator-decision-candidate-inspection-artifact",
    "inspectionArtifactPath": "packages/core/src/index.mjs#createNonAuthorizingEvaluatorDecisionCandidateInspectionArtifactForReview",
    "dispositionBoundaryPath": "packages/core/src/index.mjs#createHumanToolInspectionDispositionBoundaryForReview",
    "sourceInspectionArtifactFixture": "tests/fixtures/host-policy/phase5-30/non-authorizing-evaluator-decision-candidate-inspection-artifact.json",
    "runtimeEnabled": false,
    "evaluatorResultProduced": false,
    "approvalDecisionProduced": false,
    "approvalGrantProduced": false,
    "evaluatorExecutionPerformed": false
  },
  "dispositionBoundarySummary": {
    "humanToolInspectionDispositionBoundaryRecorded": true,
    "boundaryKind": "human-tool-inspection-disposition-boundary",
    "boundaryReviewOnly": true,
    "boundaryAuthoritative": false,
    "validInspectionArtifactProducesDispositionState": true,
    "missingInspectionArtifactRejected": true,
    "malformedInspectionArtifactRejected": true,
    "emptyInspectionArtifactRejected": true,
    "conflictingInspectionArtifactRejected": true,
    "staleInspectionArtifactRejected": true,
    "revokedInspectionArtifactRejected": true,
    "unknownInspectionArtifactRejected": true,
    "duplicateInvalidInspectionArtifactRejected": true,
    "authorizingLookingInspectionArtifactRejected": true,
    "grantLookingInspectionArtifactRejected": true,
    "approvalDecisionLookingInspectionArtifactRejected": true,
    "approvalGrantLookingInspectionArtifactRejected": true,
    "evaluatorResultLookingInspectionArtifactRejected": true,
    "evaluatorExecutionLookingInspectionArtifactRejected": true,
    "runtimePermissionLookingInspectionArtifactRejected": true,
    "commandExposureLookingInspectionArtifactRejected": true,
    "runtimeEffectTrueInspectionArtifactRejected": true,
    "processFlagTrueInspectionArtifactRejected": true,
    "unsafeInspectionArtifactRejected": true,
    "executionSignalLookingInspectionArtifactRejected": true,
    "dispositionStateIsApprovalDecision": false,
    "dispositionStateIsApprovalGrant": false,
    "evaluatorResultProduced": false,
    "evaluatorResultPersisted": false,
    "approvalDecisionProduced": false,
    "approvalDecisionPersisted": false,
    "approvalGrantProduced": false,
    "approvalGrantPersisted": false,
    "runtimePermissionGranted": false,
    "commandExposurePermissionGranted": false,
    "runtimeEnabled": false,
    "runtimeCommandEnabled": false,
    "runtimeCommandExposureEnabled": false,
    "runtimeExecutionEnabled": false,
    "evaluatorExecutionPerformed": false,
    "serveRuntimeStillDefaultBlocked": true,
    "dryRunBypassesBlock": false,
    "canEnableRuntime": false
  },
  "dispositionBoundaryInputShape": {
    "inspectionArtifactsRequired": true,
    "inspectionArtifactSchema": "ardyn.phase-5.30.non-authorizing-evaluator-decision-candidate-inspection-artifact",
    "inspectionArtifactMode": "review-only",
    "validInspectionArtifactRequired": true,
    "authorizingLookingInspectionArtifactPolicy": "fail-closed",
    "grantLookingInspectionArtifactPolicy": "fail-closed",
    "approvalDecisionLookingInspectionArtifactPolicy": "fail-closed",
    "approvalGrantLookingInspectionArtifactPolicy": "fail-closed",
    "evaluatorResultLookingInspectionArtifactPolicy": "fail-closed",
    "evaluatorExecutionLookingInspectionArtifactPolicy": "fail-closed",
    "runtimePermissionLookingInspectionArtifactPolicy": "fail-closed",
    "commandExposureLookingInspectionArtifactPolicy": "fail-closed",
    "runtimeEffectTrueInspectionArtifactPolicy": "fail-closed",
    "processFlagTrueInspectionArtifactPolicy": "fail-closed",
    "unsafeTopLevelInspectionArtifactPolicy": "fail-closed",
    "unsafeNestedInspectionArtifactDispositionDataPolicy": "fail-closed",
    "executionSignalLookingInspectionArtifactPolicy": "fail-closed",
    "conflictingInputPolicy": "fail-closed",
    "duplicateInvalidInputPolicy": "fail-closed",
    "filesystemWatcherAllowed": false,
    "externalSourceLookupAllowed": false,
    "secretsEnvIngestionAllowed": false,
    "filePathAllowed": false,
    "urlAllowed": false
  },
  "dispositionBoundaryResultShape": {
    "schema": "ardyn.phase-5.31.human-tool-inspection-disposition-boundary-result",
    "schemaVersion": "0.1.0",
    "boundaryKind": "human-tool-inspection-disposition-boundary",
    "boundaryMode": "review-only",
    "dispositionStateSchema": "ardyn.phase-5.31.review-only-human-tool-inspection-disposition-state",
    "dispositionStateKind": "review-only-human-tool-inspection-disposition-state",
    "reviewOnly": true,
    "reviewArtifactOnly": true,
    "authoritative": false,
    "dispositionStateIsApprovalDecision": false,
    "dispositionStateIsApprovalGrant": false,
    "evaluatorResultProduced": false,
    "evaluatorResultPersisted": false,
    "approvalDecisionProduced": false,
    "approvalDecisionPersisted": false,
    "approvalGrantProduced": false,
    "approvalGrantPersisted": false,
    "runtimePermissionGranted": false,
    "commandExposurePermissionGranted": false,
    "runtimeCommandExposureEnabled": false,
    "runtimeExecutionEnabled": false,
    "evaluatorExecutionRequested": false,
    "evaluatorExecutionStarted": false,
    "evaluatorExecutionEnabled": false,
    "evaluatorExecuted": false
  },
  "dispositionBoundaryCases": [
    {
      "caseId": "missing-human-tool-inspection-disposition-boundary-input-rejected",
      "classification": "missing_human_tool_inspection_disposition_boundary_input_rejected",
      "reviewOnly": true,
      "authoritative": false,
      "reviewArtifactOnly": true,
      "dispositionStateProduced": false,
      "dispositionStateIsApprovalDecision": false,
      "dispositionStateIsApprovalGrant": false,
      "evaluatorResultProduced": false,
      "evaluatorResultPersisted": false,
      "evaluatorResultId": null,
      "approvalDecisionProduced": false,
      "approvalDecisionPersisted": false,
      "approvalDecisionId": null,
      "approvalGrant": {
        "produced": false,
        "persisted": false,
        "grantId": null,
        "schema": "ardyn.runtime-approval-grant",
        "schemaVersion": "not-implemented"
      },
      "approvalGrantProduced": false,
      "approvalGrantPersisted": false,
      "approvalGrantId": null,
      "runtimePermissionGranted": false,
      "commandExposurePermissionGranted": false,
      "evaluatorExecuted": false,
      "runtimeEffect": {
        "runtimeEnabled": false,
        "runtimeStarted": false,
        "runtimeReady": false,
        "runtimeCommandEnabled": false,
        "runtimeCommandExposureEnabled": false,
        "runtimeExecutionEnabled": false,
        "runtimeExecuted": false,
        "approvalGrantProduced": false,
        "approvalGrantPersisted": false,
        "approvalEvaluatorAuthoritative": false
      }
    },
    {
      "caseId": "malformed-human-tool-inspection-disposition-boundary-input-rejected",
      "classification": "malformed_human_tool_inspection_disposition_boundary_input_rejected",
      "reviewOnly": true,
      "authoritative": false,
      "reviewArtifactOnly": true,
      "dispositionStateProduced": false,
      "dispositionStateIsApprovalDecision": false,
      "dispositionStateIsApprovalGrant": false,
      "evaluatorResultProduced": false,
      "evaluatorResultPersisted": false,
      "evaluatorResultId": null,
      "approvalDecisionProduced": false,
      "approvalDecisionPersisted": false,
      "approvalDecisionId": null,
      "approvalGrant": {
        "produced": false,
        "persisted": false,
        "grantId": null,
        "schema": "ardyn.runtime-approval-grant",
        "schemaVersion": "not-implemented"
      },
      "approvalGrantProduced": false,
      "approvalGrantPersisted": false,
      "approvalGrantId": null,
      "runtimePermissionGranted": false,
      "commandExposurePermissionGranted": false,
      "evaluatorExecuted": false,
      "runtimeEffect": {
        "runtimeEnabled": false,
        "runtimeStarted": false,
        "runtimeReady": false,
        "runtimeCommandEnabled": false,
        "runtimeCommandExposureEnabled": false,
        "runtimeExecutionEnabled": false,
        "runtimeExecuted": false,
        "approvalGrantProduced": false,
        "approvalGrantPersisted": false,
        "approvalEvaluatorAuthoritative": false
      }
    },
    {
      "caseId": "malformed-human-tool-inspection-disposition-boundary-invalid-reviewed-at-rejected",
      "classification": "malformed_human_tool_inspection_disposition_boundary_input_rejected",
      "reviewOnly": true,
      "authoritative": false,
      "reviewArtifactOnly": true,
      "dispositionStateProduced": false,
      "dispositionStateIsApprovalDecision": false,
      "dispositionStateIsApprovalGrant": false,
      "evaluatorResultProduced": false,
      "evaluatorResultPersisted": false,
      "evaluatorResultId": null,
      "approvalDecisionProduced": false,
      "approvalDecisionPersisted": false,
      "approvalDecisionId": null,
      "approvalGrant": {
        "produced": false,
        "persisted": false,
        "grantId": null,
        "schema": "ardyn.runtime-approval-grant",
        "schemaVersion": "not-implemented"
      },
      "approvalGrantProduced": false,
      "approvalGrantPersisted": false,
      "approvalGrantId": null,
      "runtimePermissionGranted": false,
      "commandExposurePermissionGranted": false,
      "evaluatorExecuted": false,
      "runtimeEffect": {
        "runtimeEnabled": false,
        "runtimeStarted": false,
        "runtimeReady": false,